{
  "id": "com.flywalk4.synthwave",
  "name": "Synthwave",
  "version": "1.1.1",
  "author": "flywalk4",
  "description": "Стекло на неоновом закате: фиолетовый, розовый, оранжевый.",
  "style": "glass",
  "appearance": "dark",
  "font": "rounded",
  "radius": 30,
  "background": {
    "colors": [
      "#1A0B3D",
      "#5B1A73",
      "#A62459",
      "#C24A2A"
    ],
    "angle": 0,
    "animation": "waves",
    "tints": [
      "#FF6AD5",
      "#C774E8",
      "#FF9E5E",
      "#36F9F6"
    ],
    "speed": 0.8
  },
  "colors": {
    "text": "#FFFFFF",
    "secondary": "#FFD6F0D9",
    "accent": "#FF6AD5",
    "card": "#2A0E4A40",
    "border": "#FF6AD540",
    "palette": {
      "green": "#72F1B8",
      "blue": "#36F9F6",
      "cyan": "#36F9F6",
      "yellow": "#FEDE5D",
      "red": "#FF3864",
      "orange": "#FF8B39",
      "purple": "#B967FF",
      "pink": "#FF71CE",
      "teal": "#01CDFE"
    }
  }
}
